{
  "event_id": "e0000005-0000-4000-8000-000000000001",
  "event_name": "web_http",
  "event_type": "http",
  "schema_version": 1,
  "occurred_at": 1793000001500,
  "priority": "normal",
  "sample_rate": 1,
  "page_id": "/task/:id",
  "view_id": "c1d2e3f4-a5b6-4c7d-8e9f-0a1b2c3d4e5f",
  "url": "https://app.example.com/task/123",
  "dimensions": {
    "method": "POST",
    "url_template": "/api/task/:id/submit",
    "status_class": "2xx"
  },
  "metrics": { "status": 200, "duration_ms": 143.5, "request_bytes": 512, "response_bytes": 128 }
}
